{
  "$schema": "https://schema.evideris.com/schemas/standard.schema.json",
  "$id": "https://schema.evideris.com/esge/standard/emr-colon/unit-pre-procedure-pathways.v1.0.0.json",
  "lineageId": "std-emr-unit-pre-procedure-pathways",
  "type": "standard",
  "version": "1.0.0",
  "release": "r2026.07",
  "supersedes": null,
  "supersededBy": null,
  "language": [
    "en"
  ],
  "withinCurriculum": "cur-emr-colon-2023",
  "appliesTo": "unit",
  "title": {
    "en": "Written and/or electronic pre-procedure pathways should exist to facilitate the assessment of patients with co-morbidity prior to EMR."
  },
  "text": {
    "en": "Written and/or electronic pre-procedure pathways should exist to facilitate the assessment of patients with co-morbidity prior to EMR."
  },
  "derivedFromRecommendation": "rec-emr-cln-r2-unit-standards",
  "subItemLabel": "i",
  "_meta": {
    "provenance": {
      "type": "verbatim",
      "source_doi": "10.1055/a-2077-0497"
    },
    "encodedBy": "human:david",
    "encodedAt": "2026-06-27"
  }
}
