{
  "$schema": "https://schema.evideris.com/schemas/standard.schema.json",
  "$id": "https://schema.evideris.com/esge/standard/emr-colon/unit-anticoagulant-protocols.v1.0.0.json",
  "lineageId": "std-emr-unit-anticoagulant-protocols",
  "type": "standard",
  "version": "1.0.0",
  "release": "r2026.07",
  "supersedes": null,
  "supersededBy": null,
  "language": [
    "en"
  ],
  "withinCurriculum": "cur-emr-colon-2023",
  "appliesTo": "unit",
  "title": {
    "en": "Local written anticoagulant management pathway"
  },
  "text": {
    "en": "Written local pre-procedure pathways should exist to direct the correct dosing of anticoagulants for patients prior to EMR based on international consensus guidelines."
  },
  "derivedFromRecommendation": "rec-emr-cln-r2-unit-standards",
  "subItemLabel": "ii",
  "_meta": {
    "provenance": {
      "type": "verbatim",
      "source_doi": "10.1055/a-2077-0497"
    },
    "encodedBy": "human:david",
    "encodedAt": "2026-06-27"
  }
}
